Key,Comments,Russian,English,English - final,Czech,PortugueseBrazilian,Spanish,Polska,SimplifiedChinese,TraditionalChinese,Japanese,Korean,Deutsch,French,Italiana,Turkish,Hungarian,Ukrainian,Vietnamese
opinion_mind.brother,,Брат/Сестра,Brother/Sister,Brother/Sister,Bratr/Sestra,Irmão/Irmã,Hermano/Hermana,Brat/siostra,兄弟/姐妹,兄/弟/姊/妹,兄弟/姉妹,남자 형제/여자 형제,Bruder/Schwester,Frère/Sœur,Fratello/Sorella,Erkek kardeş/kız kardeş,Fivér/nővér,Брат/Сестра,Anh/Chị
opinion_mind.related_marriage,30,Породнились через брак,Related through marriage,Related through marriage,Příbuznost přes svatbu,Parente por casamento,Familiar por matrimonio,Powinowactwo,姻亲关系,姻親,結婚による関係,결혼을 통한 관계,Durch Ehe verwandt,Unis par les liens du mariage,Parentela tramite matrimonio,Evlilik yolu ile akraba,Házasság révén rokon,Спорідненість через шлюб,Quan hệ thông gia
opinion_mind.returned_debt,10,Вернул долг,Returned a debt,Returned a debt,Vrácení dluhu,Pagou uma dívida,Ha devuelto una deuda,Spłacono dług,还债,償還了債務,負債を返した,빚을 갚음,Beglich eine Schuld,A payé sa dette,Ha saldato un debito,Borcunu ödedi,Megadta az adósságát,Повертає борг,Trả nợ
opinion_mind.not_returned_debt,-50,Обманул мое доверие,Betrayed my trust,Betrayed my trust,Zrada mé důvěry,Traiu minha confiança,Ha traicionado mi confianza,Złamano moje zaufanie,背叛了我的信任,辜負了我的信任,信頼を裏切った,내 신뢰를 배신함,Missbrauchte mein Vertrauen,A trahi ma confiance,Ha tradito la mia fiducia,Güvenimi kırdı,Elárulta a bizalmam,Зраджує мою довіру,Phản bội lòng tin của tôi
opinion_mind.not_returned_debt_neighbor,-15,Не отдал долг соседу,Failed to repay a debt to a neighbor,Failed to repay a debt to a neighbor,Nesplacený dluh vůči sousedovi,Não pagou uma dívida a um vizinho,No ha pagado una deuda a un vecino,Nie spłacono długu sąsiadowi,未能偿还邻邦的债务,未償還債務給鄰邦,隣人への借金の返済を怠った,이웃에 진 빚을 갚지 않음,Beglich eine Schuld bei Nachbarn nicht,N'a pas payé sa dette à une province voisine,Non ha saldato il debito con un vicino,Komşusuna borcunu ödeyemedi,Nem adta meg az adósságát a szomszédnak,Не віддає борг сусіду,Không trả nợ cho hàng xóm
opinion_mind.player_paid_tribute,5,Заплатил мне дань,Paid me tribute,Paid me tribute,Zaplatili mi příspěvek,Pagou-me tributo,Me ha pagado tributo,Zapłacono mi daninę,向我进贡,向我進貢了,敬意を表してくれた,공물 납부함,Zahlte mir Tribut,M'a payé un tribut,Mi ha pagato un tributo,Bana haraç ödedi,Hűbéradó fizetett nekem,Платить мені данину,"Đã trả tiền cống nạp cho tôi "
opinion_mind.player_refuse_to_pay,-20,Отказался платить,Refused to pay,Refused to pay,Odmítnutí zaplatit,Recusou-se a pagar,Se ha negado a pagar,Nie zgodzono się na zapłatę,拒绝支付,拒絕進貢,支払いを拒否した,지불을 거부함,Weigerte sich zu zahlen,A refusé de payer,Rifiuta di pagare,Ödemeyi reddetti,Nem volt hajlandó fizetni,Відмовляється платити,Từ chối trả
opinion_mind.king_demand_pay,-20,Вымогал у меня дань,Extorted tribute from me,Extorted tribute from me,Vymohli ze mě příspěvek,Extorquiu tributo de mim,Me ha obligado a pagar tributo,Wymuszono ode mnie daninę,向我勒索贡金,逼我進貢,貢物を納めるよう強要された,나에게 공물을 갈취해 감,Rang mir einen Tribut ab,M'a extorqué un tribut,Mi ha estorto un tributo,Benden zorla haraç aldı,Hűbéradó követelt tőlem,Данина через шантаж,Họ buộc tôi phải cống nạp cho họ
opinion_mind.attacked_me,-20,Напал на меня,Attacked me,Attacked me,Zaútočili na mě,Atacou-me,Me ha atacado,Zaatakowano mnie,攻击了我,攻擊了我,襲われた,날 공격했음,Griff mich an,M'a attaqué·e,Mi ha attaccato,Bana saldırdı,Megtámadott,Нападає на мене,Tấn công tôi
opinion_mind.attack_neighbors,-5,Нападает на соседей,Attacks neighbors,Attacks neighbors,Útočí na sousedy,Ataca vizinhos,Ataca a los vecinos,Atakuje sąsiadów,攻击邻邦,攻擊鄰邦,隣人を襲う,이웃을 공격함,Greift Nachbarn an,Attaque les provinces voisines,Attacca i vicini,Komşularına saldırıyor,Támadja a szomszédait,Нападає на сусідів,Tấn công hàng xóm
opinion_mind.attack_traity,-130,Агрессия против меня,Aggression against me,Aggression against me,Agrese proti mně,Agressão contra mim,Agresión contra mí,Agresja wobec mnie,对我的攻击,侵略我,私に対する攻撃,나에 대한 공격성,Aggression gegen mich,Agression à mon encontre,Aggressione nei miei confronti,Bana şiddet gösterdi,Ellenem támadt,Агресія проти мене,Sự xâm lược đối với tôi
opinion_mind.attack_traity_neighbors,-50,Агрессия против соседа,Aggression against a neighbor,Aggression against a neighbor,Agrese proti sousedovi,Agressão contra um vizinho,Agresión contra un vecino,Agresja wobec sąsiada,对邻邦的攻击,侵略鄰邦,隣人に対する攻撃,이웃에 대한 공격성,Aggression gegen einen Nachbarn,Agression à l'encontre d'une province voisine,Aggressione nei confronti di un vicino,Komşuya şiddet gösterdi,A szomszéd ellen támadt,Агресія проти сусіда,Sự xâm lược đối với hàng xóm
opinion_mind.attack_coward,-30,Не явился на бой,Failed to show up for a duel,Failed to show up for a duel,Nepřítomnost v souboji,Não apareceu para um duelo,No se ha presentado a un duelo,Nie stawiono się na pojedynek,未能前来决斗,失約沒來決鬥,決闘の時間になっても現れなかった,결투에 나타나지 않음,Erschien nicht zu einem Duell,A fait défaut lors d'un duel,Ha disertato un duello,Düelloya gelmedi,Nem jelent meg a párbajon,Уникнення двобою,Không xuất hiện trong trận đấu tay đôi
opinion_mind.vassal,20,Мой вассал,My vassal,My vassal,Můj vazal,Meu vassalo,En vasallaje conmigo,Mój wasal,我的附庸,我的附庸,我が従属国,내 봉신,Mein Vasall,Mon vassal,Il mio vassallo,Vasalım,A vazallusom,Мій васал,Chư hầu của tôi
opinion_mind.senior,20,Мой сеньор,My senior,My senior,Můj nadřízený,Meu superior,Mi superior,Mój senior,我的领主,我的宗主,先達,내 상관,Mein Vormund,Mon suzerain,Il mio superiore,Üstüm,A feljebbvalóm,Мій сюзерен,Cấp trên của tôi
opinion_mind.vassal_duty_did,10,Исполнил долг вассала,Fulfilled vassal's duty,Fulfilled vassal's duty,Naplněná vazalská povinnost,Cumpriu deveres como vassalo,Ha cumplido el deber del vasallaje,Spełniono obowiązek lenny,履行了附庸的职责,履行了附庸義務,従属国としての務めを果たした,봉신의 의무를 다함,Erfüllte die Vasallenpflicht,A accompli le devoir du vassal,Ha compiuto i doveri di vassallo,Vasallık görevini yerine getirdi,Teljesítette vazallusi kötelességeit,Виконує обов'язки васала,Hoàn thành nghĩa vụ chư hầu
opinion_mind.betrayal,-50,Предал меня,Betrayed me,Betrayed me,Zradili mě,Traiu-me,Me ha traicionado,Zdradzono mnie,背叛了我,背叛了我,裏切った,나를 배신함,Verriet mich,M'a trahi·e,Mi ha tradito,Bana ihanet etti,Elárult,Зраджує мене,Phản bội tôi
opinion_mind.betray_vassal_oath,-20,Нарушил клятву вассала,Broke vassal's oath,Broke vassal's oath,Porušení vazalské přísahy,Quebrou o juramento de vassalagem,Ha roto el juramento de vasallaje,Złamano przysięgę lenną,违反了附庸的誓言,違背了附庸的誓言,従属国の誓いを破った,봉신의 맹세를 깸,Brach den Vasalleneid,A brisé le serment vassalique,Ha infranto il giuramento di vassallo,Vasallık yeminini bozdu,Megszegte vazallusi esküjét,Порушення васальної клятви,Làm trái lời thề của chư hầu
opinion_mind.king_bastard,-15(короли),Бастард не должен носить корону,Bastards should not wear a crown!,Bastards should not wear a crown!,Bastardi by neměli nosit korunu!,Bastardos não devem usar coroas!,¡Los bastardos no deben llevar una corona!,Bękarci nie zasługują na koronę!,私生子没有资格戴上王冠！,私生子豈能稱王！,非嫡出子が被る王冠などない！,사생아가 왕관을 쓰면 안 되지!,Bastarde sollten keine Krone tragen!,Un bâtard ne devrait pas porter de couronne !,I bastardi non dovrebbero indossare la corona!,Piçler taç giyemez!,Fattyak ne viseljenek koronát!,Байстрюки не мають носити корони!,Con hoang không xứng đáng đội vương miện!
opinion_mind.king_woman,-10(короли),Женщина не должна носить корону,Women should not wear a crown!,Women should not wear a crown!,Ženy by neměly nosit korunu!,Mulheres não devem usar coroas!,¡Las mujeres no deben llevar una corona!,Kobiety nie zasługują na koronę!,女人没有资格戴上王冠！,女人家豈能稱王！,女が被る王冠などない！,여자가 왕관을 쓰면 안 되지!,Frauen sollten keine Krone tragen!,Une femme ne devrait pas porter de couronne !,Le donne non dovrebbero indossare la corona!,Kadınlar taç giyemez!,Nők ne viseljenek koronát!,Жінки не мають носити корони!,Phụ nữ không nên đội vương miện!
opinion_mind.greetings_me,,Поприветствовал меня,Greeted me,Greeted me,Pozdravili mě,Cumprimentou-me,Me ha saludado,Powitano mnie,向我致以问候,主動打了招呼,挨拶をした,나를 맞이함,Grüßte mich,M'a salué·e,Mi ha salutato,Beni selamladı,Köszöntött,Вітає мене,Chào đón tôi
opinion_mind.loot_my_village,72ч,Разграбил мою деревню,Looted my village,Looted my village,Vydrancovali mi vesnici,Saqueou minha aldeia,Ha saqueado mi pueblo,Splądrowano moją wioskę,掠夺了我的村庄,洗劫了我的村莊,私の村を略奪した,내 마을을 약탈함,Plünderte mein Dorf,A pillé mon village,Ha saccheggiato il mio villaggio,Köyümü yağmaladı,Kifosztotta a falumat,Розграбування мого села,Cướp bóc làng của tôi
opinion_mind.friend_of_bandits,72ч,Связался с лесными бандитами,Makes deals with forest bandits,Makes deals with forest bandits,Spolčení s lesními zbojníky,Faz negócios com bandidos da floresta,Hace tratos con bandidos del bosque,Dogaduje się z leśnymi bandytami,与森林强盗做交易,和林中劫匪勾結,森の盗賊と取引をする,숲속 도적단과 협상함,Macht Geschäfte mit Waldbanditen,Passe des accords avec les bandits de la forêt,Stringe accordi con i fuorilegge delle foreste,Orman haydutları ile anlaşma yapıyor,Lepaktál az erdei banditákkal,Домовляється з лісовими розбійниками,Hãy thỏa thuận với bọn cướp rừng
opinion_mind.enemy_of_bandits,72ч,Уничтожает лесных бандитов,Defeats forest bandits,Defeats forest bandits,Poráží lesní zbojníky,Derrota bandidos da floresta,Derrota a los bandidos del bosque,Zwalcza leśnych bandytów,打败了森林强盗,擊潰了林中劫匪,森の盗賊を打ち倒す,숲속 도적단을 처치함,Besiegt Waldbanditen,A vaincu les bandits de la forêt,Sconfigge i fuorilegge delle foreste,Orman haydutlarını yeniyor,Leveri az erdei banditákat,Перемагає лісових розбійників,Đánh bại bọn cướp trong rừng
opinion_mind.killed_wolves,72ч,Уничтожил стаю волков,Killed a wolf pack,Killed a wolf pack,Zabití vlčí smečky,Matou uma matilha de lobos,Ha matado a una manada de lobos,Zabito watahę żerwilków,杀死了一群狼,宰了一群狼,オオカミの群れを殺した,늑대 무리를 처치함,Hat ein Wolfsrudel getötet,A tué une meute de loups,Ha ucciso un branco di lupi,Bir etbörü sürüsünü öldürdü,Leölt egy falkányi farkast,Винищено вовчу зграю,Giết một bầy sói
opinion_mind.kicked_out,72 - 12,Выгнал меня,Exiled me,Exiled me,Vyhnali mě,Exilou-me,Me ha exiliado,Wygnano mnie,流放了我,流放了我,私を国外追放した,날 추방함,Verbannte mich,A provoqué mon exil,Mi ha esiliato,Beni sürgün etti,Száműzött engem,Виганяє мене,Lưu đày tôi
opinion_mind.take_title,,Лишил меня титула и выгнал,Deprived me of my title and expelled me,Deprived me of my title and expelled me,Vyhnali mě,Removeu meu título e me expulsou,Me ha exiliado,Wygnano mnie,褫夺了我的爵位并驱逐了我,革除了我的爵位並驅逐我,私の爵位を剥奪し、追放した,내 작위를 박탈하고 추방함,Beraubte mich meines Titels und verbannte mich,M'a volé mon titre et a provoqué mon exil,Mi ha tolto il titolo e mi ha imposto l'esilio,Beni ünvanımdan yoksun bıraktı ve kovdu,Száműzött engem,Виганяє мене,Tước bỏ danh hiệu và trục xuất tôi
opinion_mind.kicked_out_my_lord,,Выгнал моего лорда,Exiled my lord,Exiled my lord,Vyhnali mého lorda,Exilou meu nobre,Ha exiliado a mi señor,Wygnano mego lorda,流放了我的领主,流放了我的貴族,領主を国外追放した,내 영주를 추방함,Verbannte meinen Lord,A exilé mon seigneur/ma dame,Ha esiliato un mio nobile,Asilzademi sürgün etti,Száműzte az egyik nemesem,Виганяє мого вельможу,Lưu đày lãnh chúa của tôi
opinion_mind.discharge,,Разрядка отношений,Relief of relations,Relief of relations,Úleva ze vztahů,Dispensa de relações,Alivio de relaciones,Zepsucie stosunków,缓和关系,關係和緩,関係の緩和,관계 해소,Entlastete Beziehungen,Libéré·e de ses relations,Distensione dei rapporti,Gerginlikten sonra rahatlama,Megszakítom a kapcsolatot,Полегшення стосунків,Cải thiện quan hệ
opinion_mind.free_lord_terror,-30,Покушение на свободного лорда,Attempt on the free lord's life,Attempt on the free lord's life,Pokus o život svobodného lorda,Tentativa de assassinato do nobre livre,Atentado contra la vida de un señor libre,Próba morderstwa wolnego lorda,企图杀害自由领主,企圖殺害流浪貴族,自由領主の命をかける,자유 영주에 대한 살해 기도,Attentat auf den Freien Lord,A tenté de tuer un/une noble libre,Attentato alla vita del nobile libero,Özgür asilzadenin canına kastedildi,Egy szabad nemes életére tört,Спроба вбивства вільного вельможі,Cố giết lãnh chúa lang thang
opinion_mind.my_teacher,,Мой учитель,My teacher,My teacher,Můj učitel,Ensina-me,Mi maestro,Naucza mnie,我的导师,我的導師,教師,내 교사,Unterrichtet mich,Mon/ma mentor,Il mio insegnante,Öğretmenim,A mentorom,Мій вчитель,Giáo viên của tôi
opinion_mind.dictator_habits,,Диктаторские замашки,Dictatorial tendencies,Dictatorial tendencies,Diktátorské sklony,Tendências ditatoriais,Tendencias dictatoriales,Zapędy dyktatorskie,独裁倾向,有獨裁傾向,独裁的傾向,독재자 성향,Diktatorische Tendenzen,Tendances dictatoriales,Inclinazioni dittatoriali,Diktatörlüğe yatkınlık,Diktatórikus tendenciái vannak,Диктаторські замашки,Khuynh hướng độc tài
opinion_mind.threatened_me,,Угрожал мне,Threatened me,Threatened me,Vyhrožovali mi,Ameaçou-me,Me ha amenazado,Grożono mi,威胁了我,威脅了我,脅した,나를 위협했음,Bedrohte mich,A proféré des menaces à mon encontre,Mi ha minacciato,Beni tehdit etti,Megfenyegetett,Погрожує мені,Đe dọa tôi
opinion_mind.crime_criminal_not_punished,,Преступник не наказан,A criminal goes unpunished,A criminal goes unpunished,Nepotrestaný zločin,Um criminoso ficou impune,Un criminal no recibe ningún castigo,Przestępca jest bezkarny,罪犯逍遥法外,有罪犯逍遙法外,犯罪者が罪を逃れる,처벌받지 않은 범죄자,Ein Verbrecher bleibt ungestraft,Un criminel qui ne sera pas puni,Un criminale è rimasto impunito,Bir suçlu cezalandırılmıyor,Nem büntetett meg egy bűnözőt,Злочинець уникнув кари,Tội phạm không bị trừng phạt
opinion_mind.friend_of_my_child,,Друг ребенка,Child's friend,Child's friend,Přítel dítěte,Amizade da minha criança,Amigo del infante,Przyjaciel dziecka,孩子的朋友,子女的朋友,子供の友人,아이의 친구,Mit meinem Kind befreundet,Ami·e de l'enfant,Amico della prole,Çocuğun arkadaşı,A gyermekem barátja,Друг дитини,Bạn của con tôi
opinion_mind.best_friend_of_my_child,,Лучший друг ребенка,Child's best friend,Child's best friend,Nejlepší přítel dítěte,Melhor amizade da minha criança,Mejor amigo del infante,Najlepszy przyjaciel dziecka,孩子的挚友,子女最要好的朋友,子供の親友,아이의 가장 친한 친구,Bester Freund meines Kindes,Meilleur·e ami·e de l'enfant,Migliore amico della prole,Çocuğun en yakın arkadaşı,A gyermekem legjobb barátja,Найкращий друг дитини,Bạn thân nhất của con tôi
opinion_mind.enemy_of_my_child,,Враг ребенка,Child's enemy,Child's enemy,Nepřítel dítěte,Inimizade da minha criança,Enemigo del infante,Wróg dziecka,孩子的敌人,子女的敵人,子供の敵,아이의 적,Mit meinem Kind verfeindet,Ennemi·e de l'enfant,Nemico della prole,Çocuğun düşmanı,A gyermekem ellensége,Ворог дитини,Kẻ thù của con tôi
opinion_mind.worst_enemy_of_my_child,,Злейший враг ребенка,Child's deadliest enemy,Child's deadliest enemy,Úhlavní nepřítel dítěte,Inimizade mortal da minha criança,Enemigo mortal del infante,Największy wróg dziecka,孩子的死敌,子女的死敵,子供の最大の敵,아이의 불구대천의 적,Todfeind meines Kindes,Pire ennemi·e de l'enfant,Nemico mortale della prole,Çocuğun ölümcül düşmanı,A gyermekem leghalálosabb ellensége,Запеклий ворог дитини,Kẻ thù nguy hiểm nhất của con tôi
opinion_mind.friend_of_my_spouce,,Друг супруга,Spouse's friend,Spouse's friend,Přítel partnera,Amizade do meu cônjuge,Amigo del cónyuge,Przyjaciel męża/żony,配偶的朋友,配偶的朋友,配偶者の友人,배우자의 친구,Mit meinem Partner befreundet,Ami·e de l'époux·se,Amico del coniuge,Eşin arkadaşı,A házastársam barátja,Друг подружжя,Bạn của vợ/chồng tôi
opinion_mind.best_friend_of_my_spouce,,Лучший друг супруга,Spouse's best friend,Spouse's best friend,Nejlepší přítel partnera,Melhor amizade do meu cônjuge,Mejor amigo del cónyuge,Najlepszy przyjaciel męża/żony,配偶的挚友,配偶最要好的朋友,配偶者の親友,배우자의 가장 친한 친구,Bester Freund meines Partners,Meilleur·e ami·e de l'époux·se,Migliore amico del coniuge,Eşin en yakın arkadaşı,A házastársam legjobb barátja,Найкращий друг подружжя,Bạn thân nhất của vợ/chồng tôi
opinion_mind.enemy_of_my_spouce,,Враг супруга,Spouse's enemy,Spouse's enemy,Nepřítel partnera,Inimizade do meu cônjuge,Enemigo del cónyuge,Wróg męża/żony,配偶的敌人,配偶的敵人,配偶者の敵,배우자의 적,Mit meinem Partner verfeindet,Ennemi·e de l'époux·se,Nemico del coniuge,Eşin düşmanı,A házastársam ellensége,Ворог подружжя,Kẻ thù của vợ/chồng tôi
opinion_mind.worst_enemy_of_my_spouce,,Злейший враг супруга,Spouse's deadliest enemy,Spouse's deadliest enemy,Úhlavní nepřítel partnera,Inimizade mortal do meu cônjuge,Enemigo mortal del cónyuge,Największy wróg męża/żony,配偶的死敌,配偶的死敵,配偶者の最大の敵,배우자의 불구대천의 적,Todfeind meines Partners,Pire ennemi·e de l'époux·se,Nemico mortale del coniuge,Eşin ölümcül düşmanı,A házastársam leghalálosabb ellensége,Запеклий ворог подружжя,Kẻ thù nguy hiểm nhất của vợ/chồng tôi
opinion_mind.sex_with_other,,Моя любовь переспала с другим,My love slept with someone else,My love slept with someone else,Moje láska se vyspala s někým jiným,Meu amor dormiu com outra pessoa,Mi amor se ha acostado con otro,Moja miłość spała z kimś innym,我的爱人和别人上床了,愛人和別人有一腿,愛する人が他人と寝た,사랑하는 사람이 다른 사람과 동침함,Meine Liebe schlief mit jemand anderem,Mon amour a couché avec quelqu'un d'autre,La mia dolce metà è andata a letto con qualcun altro,Sevgilim başka biriyle beraber oldu,A szerelmem mással hált,Моє кохання спало з кимось іншим,Người yêu tôi ngủ với người khác
opinion_mind.caring_parent,,Заботливый родитель,Caring parent,Caring parent,Milující rodič,Pai/mãe gentil,Progenitor cariñoso,Opiekuńczy rodzic,关爱孩子的父母,愛我的父母,思いやりのある親,돌보는 부모,Fürsorglicher Elternteil,Parent attentionné,Genitore amorevole,İlgili ebeveyn,Gondoskodó szülő,Дбайливі батько/мати,Cha mẹ quan tâm đến con cái
opinion_mind.good_child,,Послушный отпрыск,Obedient offspring,Obedient offspring,Poslušný potomek,Filhos obedientes,Descendencia obediente,Posłuszne dziecko,顺从的后代,乖巧的子女,従順な子孫,순종적인 자녀,Gehorsamer Nachwuchs,Descendance obéissante,Prole obbediente,İtaatkâr evlat,Engedelmes gyerek,Слухняна дитина,Con cái ngoan ngoãn
opinion_mind.start_friend,,Старый союзник,Old ally,Old ally,Starý spojenec,Aliança antiga,Antiguo aliado,Stary sojusznik,老盟友,老朋友,古き同盟,옛 동맹,Alter Verbündeter,Camarade de longue date,Alleanza di vecchia data,Eski müttefik,Régi szövetséges,Старий друг,Đồng minh cũ
opinion_mind.start_sympathy,,Симпатия,Sympathy,Sympathy,Sympatie,Simpatia,Simpatía,Sympatia,同情,志同道合,共感,공감,Sympathie,Sympathie,Solidarietà,Sempati,Rokonszenv,Симпатизує,Cảm thông
opinion_mind.start_dislike,,Неприязнь,Antipathy,Antipathy,Antipatie,Antipatia,Antipatía,Antypatia,反感,看不順眼,反感,반감,Abneigung,Antipathie,Avversione,Antipati,Ellenszenv,Антипатія,Ác cảm
opinion_mind.start_enemy,,Заклятый враг,Sworn enemy,Sworn enemy,Zapřisáhlý nepřítel,Inimizade jurada,Enemigo jurado,Zaprzysiężony wróg,宿敌,勢不兩立,宿敵,평생의 적,Erzfeind,Ennemi·e juré·e,Rivalità giurata,Baş düşman,Esküdt ellenség,Заклятий ворог,Kẻ thù không đội trời chung
opinion_mind.too_smart,,Слишком умный,Too clever,Too clever,Přílišná chytrost,Perspicácia extrema,Demasiado inteligente,Zbyt duży spryt,过于聪明,太聰明,賢すぎる,지나치게 똑똑함,Zu klug,Intelligence supérieure,Troppo intelligente,Çok zeki,Túl eszes,Завелика кмітливість,Quá thông minh
opinion_mind.sinner,,Грешник (Фанатизм),Sinner (Fanaticism),Sinner (Fanaticism),Hříšník (fanatismus),Pecador (Fanatismo),En pecado (fanatismo),Grzechy (fanatyzm),罪人（狂热）,罪人（狂熱主義）,罪人 (狂信),죄인(광신),Sünder (Fanatismus),Coupable de péchés (fanatisme),Peccato (fanatismo),Günahkâr (Fanatizm),Bűnös (fanatizmus),Грішність (фанатизм),Tội nhân (cuồng tín)
opinion_mind.was_punished,,Был наказан,Was punished,Was punished,Oběť trestu,Recebeu punição,Ha recibido un castigo,Ukarano,受到了惩罚,受到責罰,処罰された,처벌받음,Wurde bestraft,A subi un châtiment,Ha ricevuto un castigo,Cezalandırıldı,Megbüntették,Зазнає кари,Đã bị trừng phạt
opinion_mind.trade_with_enemy,,Торговал с моим врагом,Traded with my enemy,Traded with my enemy,Obchod s mým nepřítelem,Comerciou com meu inimigo,Ha comerciado con mi enemigo,Handluje z wrogiem,与我的敌人交易,與敵國貿易,敵と貿易を行った,내 적과 거래함,Trieb Handel mit meinem Feind,A fait du commerce avec mon ennemi,Ha commerciato con il nemico,Düşmanımla ticaret yaptı,Kereskedett az ellenségemmel,Торгує з моїм ворогом,Giao dịch với kẻ thù của tôi
opinion_mind.dont_kill_bandits,,Не уничтожил бандитов,Failed to eliminate bandits,Failed to eliminate bandits,Neschopnost zlikvidovat zbojníky,Não conseguiu acabar com os bandidos,No ha podido eliminar a los bandidos,Odmówiono eliminacji bandytów,未能消灭强盗,未剿滅劫匪,盗賊の撲滅に失敗した,도적단 섬멸에 실패함,Konnte die Banditen nicht besiegen,A échoué à tuer les bandits,Non ha eliminato i fuorilegge,Haydutları haklayamadı,Nem verte szét a banditákat,Не може знищити розбійників,Không thể tiêu diệt bọn cướp
